Country ID,Country Code,Country Name,Region ID,Region Name,Income Group ID,Income Group Name,Income Group Acronym,Managing Agency ID,Managing Agency Acronym,Managing Agency Name,Managing Sub-agency or Bureau ID,Managing Sub-agency or Bureau Acronym,Managing Sub-agency or Bureau Name,Implementing Partner Category ID,Implementing Partner Category Name,Implementing Partner Sub-category ID,Implementing Partner Sub-category Name,Implementing Partner ID,Implementing Partner Name,International Category ID,International Category Name,International Sector Code,International Sector Name,International Purpose Code,International Purpose Name,US Category ID,US Category Name,US Sector ID,US Sector Name,Funding Account ID,Funding Account Name,Funding Agency ID,Funding Agency Name,Funding Agency Acronym,Foreign Assistance Objective ID,Foreign Assistance Objective Name,Aid Type Group ID,Aid Type Group Name,Activity ID,Submission ID,Activity Name,Activity Description,Activity Project Number,Activity Start Date,Activity End Date,Transaction Type ID,Transaction Type Name,Fiscal Year,Transaction Date,Current Dollar Amount,Constant Dollar Amount,aid_type_id,aid_type_name,activity_budget_amount,submission_activity_id
50,BGD,Bangladesh,4,South and Central Asia,2,Lower Middle Income Country,LMIC,1,USAID,U.S. Agency for International Development,20,ASIA,Bureau for Asia,3,NGO,6,NGO - International,4000225,International Federation of Red Cross and Red Crescent Societies,9,Humanitarian,740,Disaster Prevention and Preparedness,74020,Multi-hazard response preparedness,7,Humanitarian Assistance,38,Disaster Readiness,72x1021,"Agency for International Development, Development Assistance",1,U.S. Agency for International Development,USAID,1,Economic,3,Project-Type,233847,76,"Governance, Response Readiness, Institutional and Community Preparedness in Southeast Bangladesh (GRIP) Activity.",Strengthening Disaster Risk Governance and Community Early Warning and Early Action Systems for Multi-hazard Preparedness and Response in Southeastern Bangladesh.,72038823IO00003,NULL,2026-10-17,2,Obligations,2024,01OCT2023,1334000,1242994,8,Project-type interventions - not Investment Related,.,72556
566,NGA,Nigeria,5,Sub-Saharan Africa,2,Lower Middle Income Country,LMIC,2,STATE,Department of State,126,CSO,Conflict and Stabilization Operations,2,Universities and Research Institutes,3,Universities and Research Institutes - United States,4001242,"University of California, Los Angeles",3,Governance,152,"Conflict, Peace, and Security",15220,"Civilian peace-building, conflict prevention and resolution",1,Peace and Security,6,Conflict Mitigation and Reconciliation,72x1037,Economic Support Fund,1,U.S. Agency for International Development,USAID,1,Economic,3,Project-Type,311705,137,VMS Early Warning and Early Response V2,To reduce violence against civilians in at-risk areas of Nigeria by enhancing early warning and early response efforts.,SLMAQM21CA3219,NULL,2021-09-15,2,Obligations,2021,15SEP2021,330864,353789,8,Project-type interventions - not Investment Related,.,268
1002,WLD,World,7,World,NULL,NULL,NULL,2,STATE,Department of State,67,PRM,"Population, Refugees, and Migration",3,NGO,6,NGO - International,4000225,International Federation of Red Cross and Red Crescent Societies,9,Humanitarian,720,Emergency Response,72010,Material relief assistance and services,7,Humanitarian Assistance,37,"Protection, Assistance and Solutions",19x1143,"Department of  State, Migration and Refugee Assistance",2,Department of State,STATE,1,Economic,2,Core contributions,129542,65,IFRC DREF Contribution,To support the IFRC Disaster Relief Emergency Fund program to replensh funds allocated for population movements resulting from conflict,SPRMCO20VC0112,NULL,2021-06-03,3,Disbursements,2021,03JUN2021,250000,267322,6,Contributions to specific-purpose programmes and funds managed by international organisations,.,19667
1002,WLD,World,7,World,NULL,NULL,NULL,2,STATE,Department of State,67,PRM,"Population, Refugees, and Migration",3,NGO,6,NGO - International,4000225,International Federation of Red Cross and Red Crescent Societies,9,Humanitarian,720,Emergency Response,72010,Material relief assistance and services,7,Humanitarian Assistance,37,"Protection, Assistance and Solutions",19x1143,"Department of  State, Migration and Refugee Assistance",2,Department of State,STATE,1,Economic,2,Core contributions,129547,65,IFRC FY 2023 NSIA and DREF,"Funding to support IFRC's National Society Investment Alliance for strategic development and capacity building, and the Disaster Relief Emergency Fund for operations for population movements resulting from conflict-related emergencies",SPRMCO23VC0330,NULL,2023-09-29,2,Obligations,2023,29SEP2023,910000,867957,6,Contributions to specific-purpose programmes and funds managed by international organisations,.,19672
1033,SSN,Sub-Saharan Africa Region,5,Sub-Saharan Africa,NULL,NULL,NULL,2,STATE,Department of State,53,AF,African Affairs,1,Government,1,Government - United States,1000004,U.S. Government - Department of State,3,Governance,152,"Conflict, Peace, and Security",15210,Security system management and reform,1,Peace and Security,1,Counter-Terrorism,72x1037,Economic Support Fund,1,U.S. Agency for International Development,USAID,1,Economic,3,Project-Type,71586,46,Partnership for Regional East Africa Counterterrorism (PREACT): Early Warning/Early Response for Countering Violent Extremism,"Expand field of research and applicability of innovative and effective early warning and early response systems for Countering Violent Extremism (CVE) among practitioners in Djibouti, Kenya, Tanzania, Uganda, and Somalia. Managed by Embassy Djibouti.",NULL,NULL,NULL,2,Obligations,2018,"",150000,171287,8,Project-type interventions - not Investment Related,.,132
1033,SSN,Sub-Saharan Africa Region,5,Sub-Saharan Africa,NULL,NULL,NULL,2,STATE,Department of State,65,OES,Oceans and International Environmental and Scientific Affairs,7,Multilateral,18,Multilateral - Other,4011021,African Risk Capacity Group,7,Other,430,Other Multisector,43060,Disaster Risk Reduction,7,Humanitarian Assistance,38,Disaster Readiness,72x1037,Economic Support Fund,1,U.S. Agency for International Development,USAID,1,Economic,3,Project-Type,108198,61,Africa Disaster Risk Financing,This program will help African governments improve their capacities to respond to food insecurity caused or exacerbated by extreme climate events by increasing access to risk insurance products that would make them less vulnerable to future shocks.,SAQMIP23GR0026,NULL,2023-07-11,2,Obligations,2023,11JUL2023,11731000,11189009,8,Project-type interventions - not Investment Related,.,2013
1033,SSN,Sub-Saharan Africa Region,5,Sub-Saharan Africa,NULL,NULL,NULL,2,STATE,Department of State,65,OES,Oceans and International Environmental and Scientific Affairs,7,Multilateral,18,Multilateral - Other,4011021,African Risk Capacity Group,7,Other,430,Other Multisector,43060,Disaster Risk Reduction,7,Humanitarian Assistance,38,Disaster Readiness,72x1037,Economic Support Fund,1,U.S. Agency for International Development,USAID,1,Economic,3,Project-Type,108199,61,Africa Disaster Risk Financing,This program will help African governments improve their capacities to respond to food insecurity caused or exacerbated by extreme climate events by increasing access to risk insurance products that would make them less vulnerable to future shocks.,SAQMIP23GR0026,NULL,2023-09-21,3,Disbursements,2023,21SEP2023,78045,74439,8,Project-type interventions - not Investment Related,.,2014
